{
  "page_id": "token",
  "page_name": "Token Landing Page",
  "entry_page": "token",
  "reference_image": "references/token-reference.png",
  "artifacts_dir": "artifacts/token",
  "viewport": {
    "width": 1280,
    "height": 800
  },
  "validation": {
    "pixel_diff_threshold": 16,
    "max_diff_ratio": 0.22,
    "max_mean_abs_diff": 26.0,
    "require_size_match": false
  },
  "completion": {
    "require_validation_pass": true
  },
  "failure_policy": {
    "max_iterations": 8,
    "stop_on_build_error": true,
    "stop_on_missing_reference": true,
    "stop_on_validation_script_error": true
  },
  "notes": [
    "Reference image should be a stable screenshot from the target page.",
    "The automated validator is a coarse visual gate, not a replacement for human review."
  ]
}
